speciesType,tissueType,cellName,geneSymbol
Mouse,Blood,Hematopoietic stem cell,"Itgal,  Procr, Slamf1,  Cd48, Pecam1,  Kit,  Ly6a, Cd38, Abcg2, Cd34,  Thy1, Emcn,  Cd34, Kit,  Slamf1, Ptprc,  NA,  Itgam,  Cd19,  Cd3d,  Cd3e,  Cd3g,  Cd4,  Cd8a,  Ly6g,  Ly76,  Cd47,  Flt3, Cyld,  Cyp26b1,  Gprc5c, Btg2,  Ctla2a,  Egr1,  Fosb,  Gata2,  Gm17757,  Hlf,  Ikzf2,  Mecom,  Meis1,  Mpl,  Pbx1,  Pigr,  Cavin1,  Satb1,  Sox4,  Tsc22d1, Maged2,  Plcb4,  Rbp1,  1110008F13Rik,  1700094D03Rik,  1810062G17Rik,  2010111I01Rik,  2210017G18Rik,  2510009E07Rik,  2700081O15Rik,  2900006B11Rik,  2900018N21Rik,  2900072G11Rik,  2900084O13Rik,  2900092N22Rik,  5230400M06Rik,  5730409L17Rik,  5830408B19Rik,  6030498E09Rik,  6330403K07Rik,  6720407P12Rik,  6720422M22Rik,  6720454L07Rik,  8430408G22Rik,  9030425L15Rik,  9130008F23Rik,  9330156P08Rik,  9530010C24Rik,  A130009I22Rik,  A3galt2,  A730056I06Rik,  A730059M13Rik,  Abca5,  Abcg3,  Actn3,  Acvr2a,  Adam22,  Adarb1,  Adcy7,  Adcy9,  Adipor1,  Adrb2,  Agpat4,  AI661453,  AI956758,  Ak3,  Ak7,  Aldh1a1,  Aldoc,  Amigo2,  Anxa4,  Apoe,  App,  Aqp1,  Arhgap29,  Arhgap31,  Arl10,  Asb4,  Asph,  Atg4c,  Atp10d,  Atp9a,  Bgn,  Birc3,  Bmp2,  Bmper,  Btbd3,  C030034E14Rik,  C1rl,  C230037E05Rik,  C77080,  Cables1,  Cacnb2,  Cadps2,  Calml4,  Car3,  Car9,  Card10,  Casp12,  Cav2,  Cbr3,  Ccdc136,  Ccdc152,  Ccdc157,  Ccr5,  Cd151,  Cd28,  Cd74,  Cdcp1,  Cdkn1c,  Cds1,  Chad,  Chst15,  Chst2,  Chst7,  Cldn12,  Cldn4,  Clec1a,  Clu,  Col1a2,  Col4a1,  Col4a2,  Coro2b,  Cpa3,  Cpn1,  Cpne8,  Crebl2,  Crebrf,  Crispld1,  Cry2,  Csdc2,  Csf2rb2,  Cstf2t,  Ctf1,  Ctsf,  Cttn,  Cttnbp2,  Cttnbp2nl,  Cul7,  Cx3cl1,  Cyp2j9,  Cyp7b1,  Cystm1,  D630039A03Rik,  D630045J12Rik,  Ddx39,  Dennd4a,  Dhx57,  Disc1,  Dkkl1,  Dlc1,  Dmd,  Dnajb5,  Dnhd1,  Dnmt3b,  Dock1,  Dock6,  Dock7,  Dpys,  Dsel,  Dsg2,  Dusp26,  Dusp3,  E130308A19Rik,  Efna1,  Egln3,  Ehd3,  Elmo3,  Emp1,  Enah,  Eng,  Eno2,  Erp27,  Esr1,  Exoc6b,  Exph5,  Eya1,  F11r,  F830016B08Rik,  Fads2,  Fam131a,  Fam213a,  Fam222b,  Fam83h,  Fam84b,  Fbxl17,  Fcgrt,  Fgd5,  Fgf11,  Fgfr3,  Fhl1,  Fkbp1b,  Fkbp9,  Flywch2,  Foxa3,  Fstl1,  Fut4,  Fzd3,  Fzd4,  Fzd6,  Galnt3,  Gas6,  Gata1,  Gata3,  Gbp10,  Gbp6,  Gbp8,  Gbp9,  Gcnt2,  Gda,  Gdf3,  Gfi1,  Ghr,  Gimap3,  Gimap5,  Gimap8,  Gja1,  Gjb5,  Gkap1,  Gkn3,  Glipr1l1,  Glis1,  Glis2,  Gm10499,  Gm10651,  Gm11100,  Gm12258,  Gnai1,  Gnb4,  Gprasp2,  Grb10,  Grina,  Gspt2,  Gsta4,  Gstm1,  H2-Eb1,  Hbegf,  Hdac11,  Hey1,  Hid1,  Hilpda,  Hivep3,  Hmga2,  Hoxa10,  Hoxa2,  Hoxa5,  Hoxb3,  Hoxb5,  Hoxb7,  Hs1bp3,  Ick,  Id4,  Ifitm1,  Igf1,  Igf1r,  Igf2,  Igf2r,  Ikzf4,  Il11ra1,  Impad1,  Inha,  Inhba,  Insrr,  Ipo11,  Iqsec2,  Irf6,  Itsn1,  Jag2,  Jam2,  Jam3,  Kazald1,  Kazn,  Kcnip3,  Klf12,  Klhl13,  Klrb1c,  Lima1,  Lrch2,  Ltbp3,  Lurap1,  Lysmd2,  Maf,  Maged1,  Magee1,  Magi1,  Magi2,  Mapk12,  Mapk14,  Mapre3,  Mdfi,  Mfap2,  Mgst1,  Mgst2,  Mks1,  Mllt3,  Mmp2,  Mmp28,  Mmrn1,  Mn1,  Morc4,  Mpdz,  Mpp7,  Mpzl1,  Msrb3,  Mtf2,  Mum1l1,  Myct1,  Mylk,  Myo10,  Myo5c,  Myof,  Nabp1,  Naip5,  Nap1l3,  Nav2,  Nbea,  Nbeal2,  Ndn,  Ndrg2,  Ndrg4,  Neb,  Neil2,  Neo1,  Neto2,  Neu1,  Nfat5,  Nicn1,  Nlrc5,  Nova1,  Npas2,  Nphp1,  Npr2,  Nr4a2,  Nrxn1,  Ntf5,  Nudt11,  Obscn,  Obsl1,  Ociad2,  Ocln,  Osgin1,  P2rx1,  P2ry14,  Panx2,  Pbld1,  Pbx3,  Pcbd1,  Pcdh10,  Pcdhb17,  Pcgf5,  Pde1b,  Pde6h,  Pde8a,  Pdgfc,  Pdk4,  Peg12,  Peg3,  Per3,  Pex13,  Pgr,  Phlda2,  Phldb1,  Phldb2,  Pitx2,  Pkia,  Pkn1,  Pkp2,  Pla2g7,  Plekhg1,  Plekhg6,  Plscr4,  Plxdc2,  Pnck,  Polb,  Pon1,  Pon3,  Pou2f2,  Ppp1r11,  Ppp1r16b,  Pqlc3,  Prdm16,  Prkg1,  Prnp,  Prr15,  Prss41,  Psma8,  Ptges,  Ptgs1,  Ptov1,  Ptpn21,  Pvr,  Rab20,  Rab27b,  Rab38,  Rai14,  Rai2,  Ranbp2,  Rarb,  Rbbp6,  Rbbp9,  Rbpms,  Rc3h2,  Rfxank,  Rgl1,  Rhbdf1,  Rhbdf2,  Rhobtb1,  Rhobtb3,  Rhoj,  Rilp,  Ripk4,  Rnf180,  Robo4,  Rora,  Rpp30,  Rufy2,  Runx1t1,  Rusc2,  Rwdd3,  Ryk,  Ryr3,  Samhd1,  Sat1,  Scmh1,  Sdc2,  Sdc4,  Sema4b,  Sema6d,  Serpinb8,  Serpinf1,  Setbp1,  Sfrp1,  Sgms1,  Sgsm1,  Sh3gl3,  Sh3rf3,  Shank3,  Shd,  Shroom3,  Siah2,  Slc16a12,  Slc16a9,  Slc17a8,  Slc18a2,  Slc19a3,  Slc22a3,  Slc23a2,  Slc2a10,  Slc35d1,  Slc39a13,  Slc6a15,  Slc9a3r2,  Smad1,  Smarca1,  Snap23,  Snn,  Snrpn,  Sntg2,  Socs2,  Sorbs2,  Sox5,  Sox9,  Speg,  Spin4,  Spo11,  Spred1,  Src,  St3gal6,  St7,  Stox2,  Stx1a,  Sult1a1,  Sytl4,  Tac1,  Tbc1d8,  Tbr1,  Tbxas1,  Tceal1,  Tcf12,  Tcf3,  Tcf7l2,  Tead2,  Tead3,  Tek,  Tfpi,  Tgfa,  Tgm2,  Thsd1,  Timp3,  Tle1,  Tle2,  Tle6,  Tm4sf1,  Tmcc1,  Tmtc2,  Tnip3,  Tnk2,  Tnks1bp1,  Tox,  Traf1,  Trib2,  Trib3,  Trim14,  Trim16,  Trim47,  Trim6,  Trpc6,  Tslp,  Ttc19,  Ttc3,  Ttc30b,  Ttc8,  Ttpa,  Unc45b,  Upp1,  Usp27x,  Usp53,  Vasn,  Vat1,  Vdr,  Vegfc,  Vldlr,  Vnn1,  Vwf,  Wdr78,  Wfdc2,  Wnk4,  Wwtr1,  Xkr6,  Yes1,  Ypel2,  Zbtb4,  Zcchc12,  Zfand5,  Zfp111,  Zfp184,  Zfp354a,  Zfp37,  Zfp467,  Zfp521,  Zfp612,  Zfp618,  Zfp64,  Zfp831,  Zfp945,  Zfr2,  Znfx1,  Zxdb,  Ptprc,  Il7r"
Mouse,Blood,Hematopoietic cell,"Vav1, Ptprc,  Ly76, Kit"
Mouse,Blood,Embryonic stem cell,"B2m,  Bmp4,  T2,  Fgf4,  Lif,  Lifr,  Nanog,  Pou5f1,  Zfp42,  Sox2,  Stat3,  Tert, Alpl,  Fut4, Pou5f1, Nanog, Kit,  Cd24a,  Itgb1,  Pecam1,  Cdh1,  Epcam,  Cd59a,  Cd9"
Mouse,Blood,Mesenchymal progenitor cell,"Cd14, Pdgfra, Eng,  Alcam,  Cd44,  Nt5e, Acta2, S100a4,  NA, Ccnb2,  Cd52,  Cks2,  Ezh2,  H2afx,  Hist1h2ap,  Hmgb2,  Hmgb3,  Mcm5,  Mcm6,  Ube2c,  Uhrf1"
Mouse,Blood,CD3+ T cell,"Cd3d,  Cd3e,  Cd3g"
Mouse,Blood,CD8+ T cell,"Cd8a, Cd27,  Cd28,  Cd3d,  Cd3e,  Cd3g,  Cd5,  Cd8a,  Cd8b1,  Nkg7,  Tcf7,  Trbc2"
Mouse,Blood,Leukocyte,Ptprc
Mouse,Blood,Polymorphonuclear neutrophil,Ly6g
Mouse,Blood,Cancer cell,"CK family,  Epcam"
Mouse,Blood,Basophil,"Mcpt8, Ptprc,  Itga2,  Fcer1a, Kit,  Itga2b, Itgal,  Il3ra,  Il5ra,  Anpep,  Cd40lg,  Ccr2,  Il18r1,  Il18rap,  Il2ra,  Tlr1,  Tlr2,  Tlr4,  Tlr6,  Tlr9,  Ptgdr2,  Cd33,  Cd38,  Spn,  C5ar1,  Cd9,  Cebpa,  Gata2,  Itgam,  Cd200r3, Prss34, Cebpa,  Etv6,  Foxp1,  Lmo4,  Mpo,  Prss34,  Spi1,  Runx1,  Stat3, Alox5,  Cd53,  Cpa3,  Ifitm1,  Ly6e,  Mcpt8,  Srgn"
Mouse,Blood,Megakaryocyte,"Itga2b,  Gp1ba,  Itgb3, Kit,  Slamf1,  Itga2b,  Thy1,  Cxcr4, Bsg,  Cd151,  Cd40lg,  Pecam1,  Itgav,  Selp,  Cd93,  Lrrc32,  NA, Pf4, Cd41,  Cited2,  Etv6,  Fli1,  Foxp1,  Gata2,  Mef2c,  Meis1,  Pbx1,  Pf4,  Stat3,  Zfpm1,  Vwf"
Mouse,Blood,Myeloid cell,"Itgam,  Ly6g, Ly6g,  Itgam, Csf1r,  Kit,  Ifngr1,  Itgax,  Il2rb,  Il3ra,  Il6ra,  Il7r,  Anpep,  Cd14,  Thbd,  Cd40lg,  Fcgr3,  Siglecf,  Cxcr2,  Cd19,  Ccr2,  Ccr3,  Ccr4,  Cd1d1,  Enpp3,  Mrc1,  Il18r1,  Fcer2a,  Cd24a,  Pdcd1lg2,  Tlr2,  Tlr4,  Ptgdr2,  Pecam1,  Cdh1,  Cd33,  Cd34,  Cr2,  Tnfrsf18,  Cd38,  Cd40,  Itga2b,  Spn,  Cd44,  Ptprc,  Itga2,  Sell,  Fcgr1,  Cd68,  Cd69,  Cd80,  Cd84,  Cd86,  Plaur,  Cd9,  Thy1,  Cd93,  Cx3cr1,  Adgre1,  Fcer1a,  Flt3,  Il1r1,  Il1r2,  Il1r1,  Il1r2,  Nos2,  Ly6c1,  Ly6a, Ifi207,  Alox5ap,  Apobec1,  Apoe,  Arhgdib,  Bcl2a1d,  Ccl9,  Cd53,  Clec4a2,  Clec7a,  Coro1a,  Cotl1,  Csf1r,  Csf2rb,  Cst3,  Ctsb,  Ctsc,  Ctsd,  Ctss,  Cybb,  Dab2,  Efhd2,  F13a1,  Fcer1g,  Fcgr2b,  Fermt3,  Fth1,  Fyb,  NA,  Hexa,  Ifi203,  Ifi204,  Igsf6,  Laptm5,  Lcp2,  Lgmn,  Lilrb4,  Lrmp,  Ly86,  Lyz2,  Milr1,  Ms4a6c,  Ms4a6d,  Ncf2,  Ncf4,  Ptafr,  Pycard,  Rac2,  Rassf4,  Runx1,  Sirpa,  Slfn2,  Tpd52,  Trem2,  Trpv2,  Tyrobp,  Uckl1,  Unc93b1, Adgre1,  Cd209a,  Lgals3,  Ly6c2"
Mouse,Blood,Neutrophil,"Ly6g,  NA, Prtn3, Itgam,  Cxcr4,  Ly6g,  Siglecf,  MHC class II, Itgae,  Nectin2,  Csf3r,  Csf2ra,  Fut4,  Bst1,  Cd177,  Cxcr1,  Cd24a,  Tlr1,  Tlr2,  Tlr4,  Tlr6,  Tlr9,  Cr2,  Spn,  Ceacam1,  Cd93, Csf1r,  Itgam, 1110008F13Rik,  AA467197,  Abtb1,  Adam8,  Adipor1,  Alox5ap,  Anxa1,  Arg2,  Asprv1,  Btg2,  C5ar1,  Card19,  Ccl3,  Ccl6,  Ccl9,  Ccr1,  Ccrl2,  Cd300ld,  Cd300lf,  Cdk2ap2,  Cfp,  Chil1,  Clec4d,  Clec4e,  Csrp3,  Cxcl2,  Cxcr2,  Cyp4f18,  Dgat1,  Dhrs7,  Dusp1,  Eif4ebp1,  Fos,  Fxyd5,  G0s2,  Gda,  Gdpd3,  Glipr2,  Glrx,  Gm5150,  Gm5483,  Gmfg,  Grina,  Gsr,  H2-Q10,  Hacd4,  Hdc,  Hp,  Ier2,  Ifitm1,  Ikbkap,  Il17ra,  Il1b,  Il1f9,  Il1r2,  Junb,  Lcn2,  Lilr4b,  Litaf,  Lrg1,  Map1lc3b,  Mcemp1,  Mcl1,  Mmp8,  Mmp9,  Mrgpra2b,  Mrpl33,  Msrb1,  Mxd1,  Ncf1,  Ngp,  Oas3,  Osm,  Pgd,  Pglyrp1,  Pilra,  Pilrb2,  Plp2,  Pnkp,  Prr13,  Ptgs2,  Ptp4a1,  Pygl,  R3hdm4,  Rara,  Rassf3,  Rdh12,  Retnlg,  Rgs2,  Riok3,  Rnf144a,  S100a11,  S100a6,  S100a8,  S100a9,  Slc16a3,  Slc7a11,  Slfn1,  Slfn4,  Socs3,  Sorl1,  Srgn,  Stfa2l1,  Stk17b,  Taldo1,  Tpd52,  Trem1,  Trem3,  Trim30b,  Txn1,  Tyrobp,  Ube2b,  Wfdc17,  Wfdc21,  Zfp36,  Zyx, Fcnb,  Gstm1,  Ltf, Cebpe,  Cebpa,  Etv6,  Foxp1,  Gfi1,  Spi1,  Stat3,  Elane, Elane,  Lyz2,  Mpo,  Prtn3"
Mouse,Blood,Monocyte,"Cd48, Ly6c1,  Ly6g,  NA, Itgam,  Cd68,  Adgre1, Adgre1, Ly6g,  Ly6c1,  Cd19,  Cd3d,  Cd3e,  Cd3g,  Klrb1c, Csf1r,  Itgam,  Cx3cr1, Ccr2,  Csf1r,  Ly6c2, Itgax,  Cd14,  Fcgr3, Pithd1,  Ppp1r18,  ,  2310061I04Rik,  Abcd1,  Abr,  Acap2,  Adcy7,  Add1,  Add3,  Adipor1,  AI467606,  Alkbh7,  Ap1m1,  App,  Arhgap1,  Arhgdib,  Arhgef18,  Arpp19,  Aurkaip1,  B9d2,  Bin1,  Brd4,  Bri3,  Calm2,  Ccnd1,  Cd180,  Cd7,  Cdc42se2,  Cdk5rap3,  Cfp,  Chka,  Chst12,  Clic1,  Clta,  Commd7,  Cox8a,  Crip1,  Csk,  Csnk1g2,  Cst3,  Ctnnb1,  Cux1,  Cxcr3,  Cyp27a1,  Dcaf15,  Dctpp1,  Dcxr,  Ddb1,  Ddx42,  Def6,  Dhx57,  Dscr3,  Emp3,  Etfb,  Fam168b,  Fkbp15,  Foxo1,  Fxyd5,  Gimap6,  Gpi1,  Grap,  Gtf3a,  H2-Ke6,  Hadhb,  Hagh,  Hdac5,  Herpud1,  Hip1r,  Hmgcl,  Hnrnpl,  Hspa1b,  Ifnar2,  Igsf8,  Il17ra,  Itgb7,  Kcnn4,  Klf13,  Klf2,  Klf3,  Ldb1,  Lgals3,  Lime1,  Lrwd1,  Madd,  Map3k3,  Map4k1,  Mbtps1,  Mrpl18,  Mrpl40,  Myh9,  Naa10,  Nbeal2,  Ndufb5,  Nipbl,  Npc1,  Nrm,  Nub1,  Nudt16l1,  Phax,  Pnn,  Pnpla7,  Ppp1ca,  Prkacb,  Prkd2,  Psmd4,  Ptpn6,  Rasal3,  Rasgrp2,  Rbm38,  Reep4,  Rheb,  S1pr4,  Sgk1,  Slc50a1,  Slpi,  Smc4,  Snx3,  Sra1,  Srsf9,  Stk38,  Sumf1,  Tbc1d10c,  Tbc1d17,  Tcp11l2,  Tmed3,  Tmem14c,  Tmem160,  Tmem208,  Tmem59,  Tpi1,  Tpm1,  Tprgl,  Trim8,  Tsnax,  Tspan32,  Vim,  Vps16,  Wbp2,  Wdfy4,  Ly86, Tmem258,  Ass1,  C1galt1c1,  Clec7a,  Ctsc,  Ctss,  Cxcr4,  Emb,  F13a1,  Glipr1,  Gria3,  Hpse,  Klf4,  Lgals1,  Mefv,  Mfsd1,  Ms4a6c,  Papss2,  Prdx4,  Psma2,  Rassf4,  Rgs10,  S100a10,  S100a4,  Tfec,  Tgfbi,  Tifab,  Trem2, Hbb-bs,  Car2,  Cited4,  E2f4,  Gata1,  Gata2,  Gfi1b,  Hba-a2,  Hmgb3,  Klf1,  Mbd2,  Phb2,  Phf10,  Tcf3,  Zfpm1, Ccl6,  Cebpb,  Cmpk2,  Ctsd,  Cxcl1,  Cxcl2,  Cxcl3,  Ifit1,  Il1b,  Il6,  Ly6e,  Lyz2,  Ptgs2,  Tnf, Ctss,  Cybb,  Irf8,  Ly6a"
Mouse,Blood,B cell,"Ptprc, Spn,  Ptprc,  Cd40lg, Cd19,  Cd79a,  Cd19,  Cd5,  Adgre1, Gstm1, Fasn, Cd22,  Spn, Ms4a1, Cd5,  Cd24a, Kit, Bcr,  Enpep,  Ccr10,  Itgae,  Kit,  Ifngr1,  Itgam,  Il2rb,  Il6ra,  Il7r,  Sdc1,  Fcgr3,  Cxcr4,  Cxcr5,  Cd1d1,  Ms4a1,  Cr2,  Cd22,  Fcer2a,  Il2ra,  Cd27,  Pdcd1lg2,  Pecam1,  Bst2,  Slamf7,  Cdh1,  Cd320,  Cd34,  Tnfrsf18,  Cd38,  Entpd1,  Cd40,  Cd44,  Itga2,  Sell,  Nt5e,  Cd80,  Cd84,  Cd86,  Cd9,  Cd93,  Flt3,  IgD family,  Il1r1,  Il1r2,  MHC Class II,  NA,  Ly6a, Cd180,  Tnfsf4,  Cd36,  Cd69,  Cd81, Cd79a,  Cd79b,  Ly6d,  Mzb1, Cd69,  Cxcl10,  Ifi47,  Ifit1,  Ifit2,  Ifit3,  Igtp,  Irf7,  Irgm1,  Isg15,  Isg20,  Mx1,  Oasl1,  Parp14,  Rgs1,  Rsad2,  Usp18, 4930523C07Rik,  Bank1,  Blnk,  Btla,  Cd37,  Ckap4,  Cmah,  Creld2,  Derl3,  Dnajc3,  Eaf2,  Ebf1,  Edem1,  Edem2,  Fam46c,  Fchsd2,  Fcmr,  Fcrla,  Fkbp11,  Gm8369,  H13,  H2-DMb2,  H2-Oa,  H2-Ob,  Hsp90b1,  Hspa5,  Hvcn1,  Jchain,  Krtcap2,  Manf,  Mef2c,  Pafah1b3,  Pax5,  Pold4,  Pou2af1,  Prdx4,  Ptp4a3,  Ralgps2,  Rexo2,  Scd1,  Sdf2l1,  Sec11c,  Sec61a1,  Sec61b,  Serp1,  Siglecg,  Slpi,  Smap2,  Snx2,  Spcs3,  Spib,  Srp9,  Ssr4,  Tnfrsf13b,  Tnfrsf13c,  Tnfrsf17,  Trp53inp1,  Txndc11,  Txndc5,  Vpreb3,  Xbp1, Fcrla,  Vpreb1, Cd79b"
Mouse,Blood,Platelet,"Itga2b,  Ly76, Slamf1,  Thy1,  Itga2,  Gp1ba,  Gp1bb,  Gp6, Lamp1,  Lamp2,  Mpl,  Bsg,  Cd151,  Fcer2a,  Itga2b,  Gp9,  Gp1ba,  Gp1bb,  Spn,  Cd44,  Cd47,  Itga6,  Itgav,  Itgb3,  Selp,  Cd63,  Cd69,  Cd93,  Lrrc32,  NA"
Mouse,Blood,Red blood cell (erythrocyte),"Itga2b,  Ly76, Ly76, Cd24a,  Ptprc,  Itgav,  Itgb3, Car1,  Hba-a2, Hbb-bs,  Car2,  Cited4,  Gata1,  Gata2,  Gfi1b,  Klf1,  Phf10,  Zfpm1,  Clec4d,  Mfsd2b,  Nfia,  Slc45a3"
Mouse,Blood,T cell,"Cd3d,  Cd3e,  Cd3g, Cd4, Cd8a,  Cd8a,  NA, Cd2,  Cd4,  Cd5, Sell, Gstm1, Thy1,  Thy1, Cd44,  Sell,  Cd69,  Pdcd1, Ccr10,  Itgae,  Kit,  Ifngr1,  Itgax,  Il2rb,  Il6ra,  Il7r,  Pdgfra,  Pdgfrb,  Slamf1,  Cd40lg,  Cd160,  Klrb1b,  Klrb1c,  Fasl,  Cxcr3,  Cxcr4,  Cxcr5,  Ccr3,  Ccr4,  Ccr5,  Ccr6,  Cd1d1,  Cd2,  Cd200,  Il12rb1,  Il18r1,  Cd24a,  Il2ra,  Ptgdr2,  Cd3d,  Pecam1,  Cd34,  Cr2,  Tnfrsf18,  Cd38,  Entpd1,  Cd40,  Spn,  Cd44,  Ptprc,  Itga2,  Itgav,  B3gat1,  Itgb3,  TFRC,  Nt5e,  Cd80,  Cd84,  Plaur,  Klrd1,  Cd96,  Ccr8,  Cx3cr1,  Flt3,  Foxp3,  Il1r1,  Il1r2,  Il1r1,  Il1r2,  Il21r,  Il9,  Zbtb16,  Rorc,  Ly6a, Cd3e, Bcl11b,  Cxcr6,  Fam189b,  Gimap3,  Itk,  Lef1,  Ltb,  Rapgef6,  Rasgrp1,  Rpl12,  Rplp1,  Rps16,  Rps23,  Rps4x,  Satb1,  Socs2,  Tpt1"
Mouse,Blood,Natural killer cell,"Klrb1c, Itga1,  Cxcr6, Itgax,  Ncr1, Itgae,  Itgae,  Kit,  Ifngr1,  Il2rb,  Il7r,  Fcgr3,  Cd160,  Klrb1,  Klrb1b,  Klrb1c,  Cxcr2,  Cxcr3,  Ccr6,  Cd1d1,  Cd2,  Il12rb1,  Pecam1,  Klrk1,  Slamf7,  Cd34,  Cd4,  Spn,  Cd44,  Ptprc,  Itga2,  B3gat1,  Cd69,  Cd8a,  Plaur,  Thy1,  Klrd1,  Cd96,  Cx3cr1,  Flt3,  Klrg1,  MHC class II,  Zbtb16,  Rorc,  Ly6a,  Il1rl1, Itgam,  Cd226,  Il2ra,  Nfil3,  Eomes,  Gata3,  Id2,  Ly-49 family,  Runx1,  Agpat2,  Tigit,  Tox, Klra8,  Klrc1, Fcgr3,  Ncam1, Cap1,  Ccl5,  Ccnd2,  Chsy1,  Cma1,  Cst7,  Ctla2b,  Ctsw,  Dapk2,  Dok2,  Dusp2,  Fasl,  Gem,  NA,  Gzma,  Gzmb,  Hsd11b1,  Ifitm10,  Il18rap,  Irf8,  Itgb2,  Jak1,  Klra1,  Klra4,  Klra7,  Klra8,  Klra9,  Klrb1a,  Klrb1f,  Klrc2,  Klre1,  Lamb3,  Lfng,  Nkg7,  Pole4,  Prf1,  Samd3,  Tbx21,  Txk,  Ugcg,  Vps37b, Ccl5,  Cebpa,  Etv6,  Foxp1,  Mpo,  Spi1,  Stat3"
Mouse,Blood,Dendritic cell,"Itgax,  Cd74,  Cd83,  Cd86,  Cd80,  Tlr9, Ccr7,  Itgax,  Cd40,  MHC class II, Cd80, Cd83, Itgam,  Cd19,  Cd3d,  Cd3e,  Cd3g,  Ly6g,  Klrb1c, MHC class II,  Cd24a,  Ptprc,  Siglecf,  Xcr1, Nectin2, Cd209a,  Flt3,  H2-Eb1,  Cd14,  Fcgr3, Cd74,  Cebpa,  Chd3,  Elf1,  Etv6,  Foxp1,  Id2,  Irf8,  Nfe2,  Spi1,  Sox4,  Stat3, Basp1,  Ccl5,  Fscn1,  S100a4,  Tcf7, Ccl22,  Ccr7,  Cst3,  H2-Ab1,  Ifit1, Batf3,  Ifi205,  Mycl,  Slamf7,  H2-Aa"
Mouse,Blood,CD4+ T cell,"Cd4,  Ly6c1, Cd44,  Ptprc,  Sell, Il7r,  Tnfrsf4,  Tnfrsf9,  Cd40lg,  Il2ra,  Cd27,  Btla,  Icos,  Cd28,  Cd3d,  Cd3e,  Cd3g,  Cd4,  Cd44,  Cd5,  Sell,  Sele,  Selp,  Cd69,  Cd7,  Ctla4,  Pdcd1,  Igfbp4,  Tcf7,  Trbc2"
Mouse,Blood,Activated CD8+ T cell,"Ccl5,  Cd8a,  Cd8b1,  Tcf7,  Trbc2"
Mouse,Blood,Inflammatory monocyte,"Ccl5,  S100a4"
Mouse,Blood,Germinal center B cell,"Fasn,  Prss57,  IgD family, Bcl6,  Tnfrsf13c,  Ptprc,  Fas,  NA,  Cd40lg, Aicda,  Bach2,  Bcl6,  Cd19,  Cd81,  IgG family,  Irf8,  Pax5, Basp1,  Cd79b,  Jchain"
Mouse,Blood,Induced regulatory T (Treg) cell,"Nrp1, Izumo1r,  Tcf7,  Trbc2"
Mouse,Blood,Regulatory T (Treg) cell,"Itga2,  Lag3, Il2ra,  Cd4,  Itga2, Nrp1,  Foxp3,  Cd3d,  Cd3e,  Cd3g,  Entpd1,  Ptprc,  Nt5e,  Ikzf2,  Il10,  Il12a,  Ebi3,  Mki67,  TGF-beta family, Cd101,  Il1r1,  Il1r2,  Tnfrsf9,  Ctla4,  Il2ra,  Nrp1,  Tnfrsf18,  Rel,  Ikzf4,  Izumo1r,  Lrrc32,  NA,  Stat5a,  Stat5b,  Tigit, Izumo1r,  Tcf7,  Trbc2"
Mouse,Blood,Ly6c+ monocyte,"Ccr2,  Lyz2,  S100a4"
Mouse,Blood,Plasmacytoid dendritic cell,"Tlr7,  Tlr9,  Bst2,  Ptprc,  Tcf4,  Irf8,  Siglech, Mcemp1,  Cox14,  NA,  Pagr1a,  Efcab14,  Babam1,  Acp5,  Uqcc3,  Akr1a1,  Alas1,  Ankrd13a,  Ano6,  Arl6ip4,  Atox1,  Atp2a3,  Atp5c1,  Atp5j2,  Dmac2,  Atpif1,  Avpi1,  Dst,  C1qa,  C1qc,  Capns1,  Cd68,  Cd74,  Cdc42ep3,  Chchd3,  Coro1b,  Coro7,  Cstb,  Rsrp1,  Dnajb9,  Ehbp1l1,  Eif3f,  Eif4ebp1,  Elof1,  Exoc2,  Fam173a,  Fam32a,  Tpgs1,  Gm5617,  Gngt2,  Gpx4,  Gusb,  H2-Aa,  H2-Ab1,  H2-Eb1,  Haao,  Haus8,  Hint1,  Hsd17b10,  Idh2,  Ifi30,  Il10rb,  Il12b,  Inpp4a,  Ip6k1,  Itgax,  Itm2b,  Lamp1,  Map1lc3b,  Mcm6,  Mdh2,  Mrpl34,  Ms4a7,  Ncor1,  Ndufa10,  Ndufa9,  Ndufb8,  Neurl3,  Nudt3,  P4hb,  Pip5k1c,  Pisd,  Pkn1,  Pkp3,  Plaur,  Plod3,  Plxnb2,  Plxnd1,  Ppp1r12c,  Pqlc1,  Psen2,  Psmc4,  Ptcd2,  Pycr2,  Qdpr,  Rasa3,  Rbbp7,  Rbm25,  Rogdi,  Rplp0,  Rplp1,  Rps20,  Rxra,  Sae1,  Scamp4,  Senp6,  Slc8b1,  Slc29a3,  Slc43a2,  Slc44a2,  Slc9a3r1,  Snrpd3,  Snrpf,  Spns3,  Srp14,  Ssrp1,  Syf2,  Tfeb,  Tmem176a,  Tmem176b,  Tspan14,  Ube2j1,  Usp48,  Vac14,  Bud23,  Wdr89,  Ywhah,  Zbtb7a,  Zcchc24,  Zeb2, Siglech, Bst2,  Ly6d"
Mouse,Blood,Macrophage,"Fcgr3,  Mrc1,  Fcer2a, Ly6c1,  Ly6g,  NA, Csf1r, Pdcd1lg2, macrophage galactose-type C-type lectin family, Adgre1, Dock2, Cd163,  Cd68,  Cd74,  Adgre1,  Itgam,  Lgals3,  Lyz1, Cd68, Itgax, Itgam, Mrc1, Cd40,  Nos2, Cd200r1, Kit,  Prom1,  Pecam1,  F8,  S100 family,  Kdr,  Itgax, Arg1,  Il10,  VEGF family,  Chil3,  MHC class II,  Fcgr1, Cd19,  Cd3d,  Cd3e,  Cd3g,  Klrb1c, Ptprc,  Mertk, Axl,  Lamp1,  Lamp2,  Csf1r,  Fcgr3,  Tlr2,  Tlr4,  Cdh1,  Cd40,  Tnfsf18,  Gpnmb,  MHC Class II,  cd68,  Cd14, C1qa,  C1qb,  C1qc,  Ccl12,  Cd209f,  Clec4n,  Coro1a,  Ctss,  Cxcl2,  F13a1,  Folr2,  Gatm,  Gmfg,  Lsp1,  Lyz2,  Ms4a7,  Pf4,  Pld4,  Rgs1,  Srgn,  Tyrobp,  Unc93b1, Abhd12,  Adap2,  Adrb1,  Aif1,  Apobec1,  Apoe,  Asah1,  Axl,  Basp1,  Bcl2a1b,  C1qa,  Cadm1,  Cd72,  Cd83,  Cd86,  Cdk6,  Cfh,  Clec4a2,  Clec4b1,  Col14a1,  Creb5,  Cst3,  Ctsc,  Ctsh,  Cx3cr1,  Cxcl16,  Cyth4,  Ebi3,  Fcgr2b,  Fcgr4,  Fgd2,  Fnbp1,  Fyb,  Gm4951,  Gpr65,  Gusb,  H2-Aa,  H2-Ab1,  H2-DMa,  H2-DMb1,  H2-Eb1,  Hpgds,  Hspa1a,  Ifnar1,  Inpp5d,  Itm2c,  Lacc1,  Lair1,  Lat2,  Lilra5,  Lpar6,  Ly86,  Marcks,  Mgl2,  Mknk1,  Mmp13,  Ntpcr,  P2ry6,  Parp14,  Pea15a,  Pid1,  Ppt1,  Rab7b,  Rbpj,  Rgs10,  Rtn4,  Runx1,  Scimp,  Sdc3,  Sft2d1,  Slamf9,  Slco2b1,  Stab1,  Stap1,  Stx16,  Taok3,  Tgfbr1,  Tmcc3,  Tmem176b,  Trf,  Vcam1,  Vsir,  Zmynd15, C1qb, Basp1,  Bst2,  Cd5l,  Cd79b,  Gzma,  S100a4, Lrmda,  Abca9,  Aoah,  Arhgap15,  Bank1,  Cd84,  Cmah,  Colec12,  Ctsb,  Dab2,  Dclre1c,  Ddx60,  Dock2,  Dock8,  Ehd4,  Fli1,  Gas6,  Ikzf1,  Lgmn,  Lyn,  Maf,  P2rx7,  P2ry12,  Pik3ap1,  Pnpla7,  Rbm47,  Rreb1,  Sirpa,  Slc9a9,  Snx2,  Stard8,  Tbxas1,  Tgfbr2,  Tnfaip8,  Tnfrsf11a,  Wdfy4,  Zfp710"